{
  "schema": 1,
  "nanoscope": "0.4.0",
  "path": "tests/fixtures/graphs/modern_like.py",
  "classes": [
    {
      "name": "MyModern",
      "kind": "decoder",
      "line": 4,
      "end_line": 12,
      "span": {
        "line": 4,
        "col": 0,
        "end_line": 12,
        "end_col": 9
      },
      "bases": [
        "Decoder"
      ],
      "params": [
        {
          "name": "vocab_size",
          "annotation": "int",
          "has_default": false
        },
        {
          "name": "context_length",
          "annotation": "int",
          "has_default": true,
          "default": 256
        }
      ],
      "args": {
        "vocab_size": {
          "kind": "param",
          "name": "vocab_size",
          "span": {
            "line": 7,
            "col": 12,
            "end_line": 7,
            "end_col": 22
          }
        },
        "context_length": {
          "kind": "param",
          "name": "context_length",
          "span": {
            "line": 7,
            "col": 24,
            "end_line": 7,
            "end_col": 38
          }
        },
        "d_model": {
          "kind": "literal",
          "value": 128,
          "span": {
            "line": 7,
            "col": 48,
            "end_line": 7,
            "end_col": 51
          }
        },
        "n_layers": {
          "kind": "literal",
          "value": 4,
          "span": {
            "line": 7,
            "col": 62,
            "end_line": 7,
            "end_col": 63
          }
        },
        "block": {
          "kind": "block",
          "block": "Block",
          "span": {
            "line": 8,
            "col": 18,
            "end_line": 9,
            "end_col": 90
          },
          "args": {
            "norm": {
              "kind": "block",
              "block": "RMSNorm",
              "span": {
                "line": 8,
                "col": 29,
                "end_line": 8,
                "end_col": 38
              },
              "args": {},
              "family": "norm",
              "tier": "composite"
            },
            "mlp": {
              "kind": "block",
              "block": "SwiGLU",
              "span": {
                "line": 8,
                "col": 44,
                "end_line": 8,
                "end_col": 62
              },
              "args": {
                "hidden": {
                  "kind": "literal",
                  "value": 344,
                  "span": {
                    "line": 8,
                    "col": 58,
                    "end_line": 8,
                    "end_col": 61
                  }
                }
              },
              "family": "mlp",
              "tier": "composite"
            },
            "attn": {
              "kind": "block",
              "block": "Attention",
              "span": {
                "line": 9,
                "col": 29,
                "end_line": 9,
                "end_col": 89
              },
              "args": {
                "n_heads": {
                  "kind": "literal",
                  "value": 4,
                  "span": {
                    "line": 9,
                    "col": 47,
                    "end_line": 9,
                    "end_col": 48
                  }
                },
                "n_kv_heads": {
                  "kind": "literal",
                  "value": 2,
                  "span": {
                    "line": 9,
                    "col": 61,
                    "end_line": 9,
                    "end_col": 62
                  }
                },
                "pos": {
                  "kind": "block",
                  "block": "RoPE",
                  "span": {
                    "line": 9,
                    "col": 68,
                    "end_line": 9,
                    "end_col": 74
                  },
                  "args": {},
                  "family": "positional",
                  "tier": "composite"
                },
                "qk_norm": {
                  "kind": "literal",
                  "value": true,
                  "span": {
                    "line": 9,
                    "col": 84,
                    "end_line": 9,
                    "end_col": 88
                  }
                }
              },
              "family": "attention",
              "tier": "composite"
            }
          },
          "family": "structure",
          "tier": "composite"
        },
        "final_norm": {
          "kind": "block",
          "block": "RMSNorm",
          "span": {
            "line": 10,
            "col": 23,
            "end_line": 10,
            "end_col": 32
          },
          "args": {},
          "family": "norm",
          "tier": "composite"
        },
        "tie_weights": {
          "kind": "literal",
          "value": true,
          "span": {
            "line": 11,
            "col": 24,
            "end_line": 11,
            "end_col": 28
          }
        },
        "z_loss": {
          "kind": "literal",
          "value": 0.0001,
          "span": {
            "line": 11,
            "col": 37,
            "end_line": 11,
            "end_col": 41
          }
        }
      },
      "init_span": {
        "line": 5,
        "col": 4,
        "end_line": 12,
        "end_col": 9
      },
      "call_span": {
        "line": 6,
        "col": 8,
        "end_line": 12,
        "end_col": 9
      },
      "representable": true,
      "reason": null,
      "reason_line": null
    }
  ]
}
